title,price_sale,price_regular,url,image_url,out_of_stock,description,product_type,tags,variants,images
Crocodile Pattent Long Leather Wallet PLW01,Rs.5999.00,Rs.8999.00,https://wolveyes.com/products/black-crocodile-pattent-long-leather-wallet,,False,"Elevate your accessory game with the luxurious Black Crocodile Patent Long Leather Wallet. Crafted from high-quality genuine leather, this sleek wallet boasts a striking crocodile-patterned finish that exudes sophistication and style. The glossy patent leather adds a touch of elegance, while the bold black hue ensures versatility, pairing effortlessly with any outfit.",,,Black | SKU: | Rs.5999.00 | Rs.8999.00 | Available:True | Inventory: || Solid Maroon | SKU: | Rs.5999.00 | Rs.8999.00 | Available:True | Inventory:,https://cdn.shopify.com/s/files/1/0696/6106/5406/files/crocodile-pattent-long-leather-wallet-1490953.jpg?v=1753733292 | https://cdn.shopify.com/s/files/1/0696/6106/5406/files/crocodile-pattent-long-leather-wallet-9961533.jpg?v=1753733291 | https://cdn.shopify.com/s/files/1/0696/6106/5406/files/crocodile-pattent-long-leather-wallet-5655780.jpg?v=1753733291 | https://cdn.shopify.com/s/files/1/0696/6106/5406/files/crocodile-pattent-long-leather-wallet-2699463.jpg?v=1753733293 | https://cdn.shopify.com/s/files/1/0696/6106/5406/files/crocodile-pattent-long-leather-wallet-7912009.jpg?v=1753733292 | https://cdn.shopify.com/s/files/1/0696/6106/5406/files/crocodile-pattent-long-leather-wallet-3952788.jpg?v=1753733292 | https://cdn.shopify.com/s/files/1/0696/6106/5406/files/crocodile-pattent-long-leather-wallet-6750608.jpg?v=1753733292 | https://cdn.shopify.com/s/files/1/0696/6106/5406/files/crocodile-pattent-long-leather-wallet-6611989.jpg?v=1753733293 | https://cdn.shopify.com/s/files/1/0696/6106/5406/files/crocodile-pattent-long-leather-wallet-7107726.jpg?v=1753733291
Crocodile Style Two Side Leather Belt CLB02,Rs.3500.00,Rs.4500.00,https://wolveyes.com/products/crocodile-style-two-side-leather-belt,,False,"Crafted from high-quality full-grain leather, this premium belt offers durability, comfort, and timeless style. Its sleek design and sturdy buckle make it the perfect addition to any outfit—casual or formal. Key Features: Timeless Design : Perfect for jeans, chinos, or dress trousers. Adjustable Fit : Available in multiple sizes for a custom fit. Quality Craftsmanship : Built to last with attention to detail. Elevate your wardrobe with this stylish, long-lasting belt.",,,Default Title | SKU: | Rs.3500.00 | Rs.4500.00 | Available:True | Inventory:,https://cdn.shopify.com/s/files/1/0696/6106/5406/files/crocodile-style-two-side-leather-belt-993606.webp?v=1744968401 | https://cdn.shopify.com/s/files/1/0696/6106/5406/files/crocodile-style-two-side-leather-belt-637273.webp?v=1744968402 | https://cdn.shopify.com/s/files/1/0696/6106/5406/files/crocodile-style-two-side-leather-belt-306915.webp?v=1744968401 | https://cdn.shopify.com/s/files/1/0696/6106/5406/files/crocodile-style-two-side-leather-belt-613014.webp?v=1744968402 | https://cdn.shopify.com/s/files/1/0696/6106/5406/files/crocodile-style-two-side-leather-belt-399737.webp?v=1744968402
Cross Body Bag CB01,Rs.6500.00,Rs.8500.00,https://wolveyes.com/products/laptop-bag,,False,"Here are the key details of the Crazy Horse Crossbody Bag. Material : Made from high-quality Crazy Horse leather , known for its rugged, vintage look and durability. Aging : The leather develops a unique patina over time, enhancing its natural texture and appeal. Design : Sleek and compact with a modern, minimalist style . Adjustable Strap : Comes with an adjustable crossbody strap for comfort and convenience. Compartments : Features multiple pockets and compartments to store essentials like phone, wallet, and keys. Versatile : Suitable for both casual and semi-formal outfits, making it ideal for daily use or travel. Durability : Sturdy construction designed to withstand daily wear and tear. Practicality : Lightweight yet spacious enough for essential items without being bulky. Timeless Aesthetic : The natural leather color pairs well with a wide variety of clothing styles.",Ladies & Gents,,Default Title | SKU:MC1116-010 | Rs.6500.00 | Rs.8500.00 | Available:True | Inventory:,https://cdn.shopify.com/s/files/1/0696/6106/5406/files/cross-body-bag-327493.webp?v=1744968500 | https://cdn.shopify.com/s/files/1/0696/6106/5406/files/cross-body-bag-722243.webp?v=1744968499 | https://cdn.shopify.com/s/files/1/0696/6106/5406/files/cross-body-bag-130979.webp?v=1744968500 | https://cdn.shopify.com/s/files/1/0696/6106/5406/files/cross-body-bag-657275.webp?v=1744968500 | https://cdn.shopify.com/s/files/1/0696/6106/5406/files/cross-body-bag-845569.webp?v=1744968500 | https://cdn.shopify.com/s/files/1/0696/6106/5406/files/cross-body-bag-284648.webp?v=1744968499
Dark Brown Leather Jacket sf001,Rs.23999.00,Rs.29000.00,https://wolveyes.com/products/ionic-brown-leather-jacket-sf002-copy,,False,"Embrace bold sophistication with the Ionic Black Leather Jacket, a perfect blend of sleek design and timeless edge. Crafted from high-quality black leather, this jacket offers a luxurious, supple feel while ensuring durability and long-lasting wear. The rich, deep black hue exudes versatility, allowing the jacket to pair effortlessly with any outfit, from casual to formal.",mens,,XSmall | SKU:LW0823-069 | Rs.23999.00 | Rs.29000.00 | Available:True | Inventory: || Small | SKU:LW0823-070 | Rs.23999.00 | Rs.29000.00 | Available:True | Inventory: || Medium | SKU:LW0823-071 | Rs.23999.00 | Rs.29000.00 | Available:True | Inventory: || Large | SKU:LW0823-072 | Rs.23999.00 | Rs.29000.00 | Available:True | Inventory: || XLarge | SKU:LW0823-073 | Rs.23999.00 | Rs.29000.00 | Available:True | Inventory: || 2XLarge | SKU:LW0823-074 | Rs.23999.00 | Rs.29000.00 | Available:True | Inventory:,https://cdn.shopify.com/s/files/1/0696/6106/5406/files/dark-brown-leather-jacket-sf001-398367.jpg?v=1744968499 | https://cdn.shopify.com/s/files/1/0696/6106/5406/files/dark-brown-leather-jacket-sf001-581254.jpg?v=1744968499 | https://cdn.shopify.com/s/files/1/0696/6106/5406/files/dark-brown-leather-jacket-sf001-214101.jpg?v=1744968499 | https://cdn.shopify.com/s/files/1/0696/6106/5406/files/dark-brown-leather-jacket-sf001-418368.jpg?v=1744968498 | https://cdn.shopify.com/s/files/1/0696/6106/5406/files/ionic-beidge-leather-jacket-sf005-431469.jpg?v=1744968506
Dark Brown Leather Jacket sf002,Rs.24999.00,Rs.29000.00,https://wolveyes.com/products/dark-brown-leather-jacket-sf002-copy,,False,"Embrace bold sophistication with the Ionic Black Leather Jacket, a perfect blend of sleek design and timeless edge. Crafted from high-quality black leather, this jacket offers a luxurious, supple feel while ensuring durability and long-lasting wear. The rich, deep black hue exudes versatility, allowing the jacket to pair effortlessly with any outfit, from casual to formal.",mens,,XSmall | SKU:LW0823-069 | Rs.24999.00 | Rs.29000.00 | Available:True | Inventory: || Small | SKU:LW0823-070 | Rs.24999.00 | Rs.29000.00 | Available:True | Inventory: || Medium | SKU:LW0823-071 | Rs.24999.00 | Rs.29000.00 | Available:True | Inventory: || Large | SKU:LW0823-072 | Rs.24999.00 | Rs.29000.00 | Available:True | Inventory: || XLarge | SKU:LW0823-073 | Rs.24999.00 | Rs.29000.00 | Available:True | Inventory: || 2XLarge | SKU:LW0823-074 | Rs.24999.00 | Rs.29000.00 | Available:True | Inventory:,https://cdn.shopify.com/s/files/1/0696/6106/5406/files/dark-brown-leather-jacket-sf002-240357.jpg?v=1744968506 | https://cdn.shopify.com/s/files/1/0696/6106/5406/files/dark-brown-leather-jacket-sf002-716841.jpg?v=1755085595 | https://cdn.shopify.com/s/files/1/0696/6106/5406/files/dark-brown-leather-jacket-sf002-237278.jpg?v=1755085595 | https://cdn.shopify.com/s/files/1/0696/6106/5406/files/dark-brown-leather-jacket-sf002-151003.jpg?v=1755085595 | https://cdn.shopify.com/s/files/1/0696/6106/5406/files/dark-brown-leather-jacket-sf002-294027.jpg?v=1755085595 | https://cdn.shopify.com/s/files/1/0696/6106/5406/files/dark-brown-leather-jacket-sf002-449747.jpg?v=1755085595 | https://cdn.shopify.com/s/files/1/0696/6106/5406/files/ionic-beidge-leather-jacket-sf005-431469.jpg?v=1744968506
Fish Pattent Card Wallet FCW01,Rs.3250.00,Rs.7500.00,https://wolveyes.com/products/hand-made-wallet-bifold-copy,,False,"Step up your accessory game with the Fish pattent card wallet  , a perfect blend of sleek elegance and distinctive texture. Made from high-quality Leather Wallet with card wallet with a glossy , this wallet features a unique, textured surface that sets it apart from conventional leather designs. The rich black color adds sophistication, while the shiny, reflective finish brings a modern edge.",,,Black | SKU: | Rs.3250.00 | Rs.7500.00 | Available:True | Inventory:,https://cdn.shopify.com/s/files/1/0696/6106/5406/files/fish-pattent-card-wallet-800791.jpg?v=1745062912 | https://cdn.shopify.com/s/files/1/0696/6106/5406/files/fish-pattent-card-wallet-797000.jpg?v=1745062911 | https://cdn.shopify.com/s/files/1/0696/6106/5406/files/fish-pattent-card-wallet-841034.jpg?v=1745062911 | https://cdn.shopify.com/s/files/1/0696/6106/5406/files/fish-pattent-card-wallet-892891.jpg?v=1745062912 | https://cdn.shopify.com/s/files/1/0696/6106/5406/files/fish-pattent-card-wallet-618219.jpg?v=1745062911 | https://cdn.shopify.com/s/files/1/0696/6106/5406/files/fish-pattent-card-wallet-996389.jpg?v=1745062911
Galma leather chappal GC01 Black,Rs.6900.00,Rs.8500.00,https://wolveyes.com/products/galma-leather-chappal-black,,False,"Handcrafted Leather Kaptan Chappal These traditional leather Kaptan Chapals are meticulously handcrafted for durability and comfort. Made from high-quality leather with intricate stitching, they offer a perfect blend of style and practicality. Ideal for any occasion, they provide a comfortable fit and timeless appeal. Key Features: 100% genuine leather for premium quality and long-lasting wear Handcrafted by skilled artisans with traditional techniques Comfortable, flexible sole for all-day wear Timeless, classic design suitable for various occasions Durable construction that ensures lasting performance",,,7 | SKU: | Rs.6900.00 | Rs.8500.00 | Available:True | Inventory: || 8 | SKU: | Rs.6900.00 | Rs.8500.00 | Available:True | Inventory: || 9 | SKU: | Rs.6900.00 | Rs.8500.00 | Available:True | Inventory: || 10 | SKU: | Rs.6900.00 | Rs.8500.00 | Available:True | Inventory: || 11 | SKU: | Rs.6900.00 | Rs.8500.00 | Available:True | Inventory: || 12 | SKU: | Rs.6900.00 | Rs.8500.00 | Available:True | Inventory: || 13 | SKU: | Rs.6900.00 | Rs.8500.00 | Available:True | Inventory: || 14 | SKU: | Rs.6900.00 | Rs.8500.00 | Available:True | Inventory:,https://cdn.shopify.com/s/files/1/0696/6106/5406/files/galma-leather-chappal-black-355422.webp?v=1744968508 | https://cdn.shopify.com/s/files/1/0696/6106/5406/files/galma-leather-chappal-black-258931.webp?v=1744968509 | https://cdn.shopify.com/s/files/1/0696/6106/5406/files/galma-leather-chappal-black-262805.webp?v=1744968508 | https://cdn.shopify.com/s/files/1/0696/6106/5406/files/galma-leather-chappal-black-396243.webp?v=1744968509 | https://cdn.shopify.com/s/files/1/0696/6106/5406/files/galma-leather-chappal-black-282372.webp?v=1744968508 | https://cdn.shopify.com/s/files/1/0696/6106/5406/files/galma-leather-chappal-black-826054.webp?v=1744968508 | https://cdn.shopify.com/s/files/1/0696/6106/5406/files/galma-leather-chappal-black-510219.webp?v=1744968508 | https://cdn.shopify.com/s/files/1/0696/6106/5406/files/kaptan-hand-made-chappal-we001-394313.webp?v=1747632087
Galma Leather Chappal GC01 Brown,Rs.6900.00,Rs.7500.00,https://wolveyes.com/products/galma-leather-chappal-brown-we03,,False,"Handcrafted Leather Chapal These traditional leather Kaptan Chapals are meticulously handcrafted for durability and comfort. Made from high-quality leather with intricate stitching, they offer a perfect blend of style and practicality. Ideal for any occasion, they provide a comfortable fit and timeless appeal. Key Features: 100% genuine leather for premium quality and long-lasting wear Handcrafted by skilled artisans with traditional techniques Comfortable, flexible sole for all-day wear Timeless, classic design suitable for various occasions Durable construction that ensures lasting performance",,,7 | SKU: | Rs.6900.00 | Rs.7500.00 | Available:True | Inventory: || 8 | SKU: | Rs.6900.00 | Rs.7500.00 | Available:True | Inventory: || 9 | SKU: | Rs.6900.00 | Rs.7500.00 | Available:True | Inventory: || 10 | SKU: | Rs.6900.00 | Rs.7500.00 | Available:True | Inventory: || 11 | SKU: | Rs.6900.00 | Rs.7500.00 | Available:True | Inventory: || 12 | SKU: | Rs.6900.00 | Rs.7500.00 | Available:True | Inventory: || 13 | SKU: | Rs.6900.00 | Rs.7500.00 | Available:True | Inventory: || 14 | SKU: | Rs.6900.00 | Rs.7500.00 | Available:True | Inventory:,https://cdn.shopify.com/s/files/1/0696/6106/5406/files/galma-leather-chappal-brown-we03-681416.webp?v=1744968500 | https://cdn.shopify.com/s/files/1/0696/6106/5406/files/galma-leather-chappal-brown-we03-502213.webp?v=1744968501 | https://cdn.shopify.com/s/files/1/0696/6106/5406/files/galma-leather-chappal-brown-we03-934718.webp?v=1744968501 | https://cdn.shopify.com/s/files/1/0696/6106/5406/files/galma-leather-chappal-brown-we03-361022.webp?v=1744968500 | https://cdn.shopify.com/s/files/1/0696/6106/5406/files/galma-leather-chappal-brown-we03-227084.webp?v=1744968501 | https://cdn.shopify.com/s/files/1/0696/6106/5406/files/galma-leather-chappal-brown-we03-742938.webp?v=1744968500 | https://cdn.shopify.com/s/files/1/0696/6106/5406/files/galma-leather-chappal-brown-we03-285866.webp?v=1744968500 | https://cdn.shopify.com/s/files/1/0696/6106/5406/files/kaptan-hand-made-chappal-we001-394313.webp?v=1747632087
Hair on bifold wallet HB01,Rs.3999.00,Rs.6000.00,https://wolveyes.com/products/hair-on-bifold-wallet-1,,True,"Elevate your accessory game with the luxurious Hair on bifold wallett . Crafted from high-quality genuine leather, this sleek wallet boasts a striking  Long Leather Wallet  finish that exudes sophistication and style. The glossy patent leather adds a touch of elegance, while the bold black hue ensures versatility, pairing effortlessly with any outfit.",,,White | SKU: | Rs.3999.00 | Rs.6000.00 | Available:False | Inventory:,https://cdn.shopify.com/s/files/1/0696/6106/5406/files/hair-on-bifold-wallet-324687.webp?v=1744968509 | https://cdn.shopify.com/s/files/1/0696/6106/5406/files/hair-on-bifold-wallet-478122.webp?v=1744968509 | https://cdn.shopify.com/s/files/1/0696/6106/5406/files/hair-on-bifold-wallet-587330.webp?v=1744968405 | https://cdn.shopify.com/s/files/1/0696/6106/5406/files/hair-on-bifold-wallet-425380.webp?v=1744968404 | https://cdn.shopify.com/s/files/1/0696/6106/5406/files/hair-on-bifold-wallet-533707.webp?v=1744968405 | https://cdn.shopify.com/s/files/1/0696/6106/5406/files/hair-on-bifold-wallet-822064.webp?v=1744968509 | https://cdn.shopify.com/s/files/1/0696/6106/5406/files/hair-on-bifold-wallet-629746.webp?v=1744968405 | https://cdn.shopify.com/s/files/1/0696/6106/5406/files/hair-on-bifold-wallet-321499.webp?v=1744968404 | https://cdn.shopify.com/s/files/1/0696/6106/5406/files/hair-on-bifold-wallet-450839.webp?v=1744968405 | https://cdn.shopify.com/s/files/1/0696/6106/5406/files/hair-on-bifold-wallet-714409.webp?v=1744968509 | https://cdn.shopify.com/s/files/1/0696/6106/5406/files/hair-on-bifold-wallet-128940.webp?v=1744968404 | https://cdn.shopify.com/s/files/1/0696/6106/5406/files/hair-on-bifold-wallet-733408.webp?v=1744968405 | https://cdn.shopify.com/s/files/1/0696/6106/5406/files/hair-on-bifold-wallet-291623.webp?v=1744968404 | https://cdn.shopify.com/s/files/1/0696/6106/5406/files/hair-on-bifold-wallet-731964.webp?v=1744968404
Hair on Leather Belt HLB04,Rs.4500.00,Rs.5500.00,https://wolveyes.com/products/hair-on-leather-belt,,False,"Crafted from high-quality full-grain leather, this premium belt offers durability, comfort, and timeless style. Its sleek design and sturdy buckle make it the perfect addition to any outfit—casual or formal. Key Features: Timeless Design : Perfect for jeans, chinos, or dress trousers. Adjustable Fit : Available in multiple sizes for a custom fit. Quality Craftsmanship : Built to last with attention to detail. Elevate your wardrobe with this stylish, long-lasting belt.",,,Default Title | SKU: | Rs.4500.00 | Rs.5500.00 | Available:True | Inventory:,https://cdn.shopify.com/s/files/1/0696/6106/5406/files/hair-on-leather-belt-125292.webp?v=1744968404 | https://cdn.shopify.com/s/files/1/0696/6106/5406/files/hair-on-leather-belt-992230.webp?v=1744968403 | https://cdn.shopify.com/s/files/1/0696/6106/5406/files/hair-on-leather-belt-398701.webp?v=1744968404 | https://cdn.shopify.com/s/files/1/0696/6106/5406/files/hair-on-leather-belt-394433.webp?v=1744968404 | https://cdn.shopify.com/s/files/1/0696/6106/5406/files/hair-on-leather-belt-493443.webp?v=1744968404 | https://cdn.shopify.com/s/files/1/0696/6106/5406/files/hair-on-leather-belt-941288.webp?v=1744968403 | https://cdn.shopify.com/s/files/1/0696/6106/5406/files/hair-on-leather-belt-737092.webp?v=1744968403
Hand made kaptan chappal brown KHC01,Rs.12500.00,Rs.16500.00,https://wolveyes.com/products/hand-made-kaptan-chappal-brown-we003,,True,"Handcrafted Leather Kaptan Chapal These traditional leather Kaptan Chapals are meticulously handcrafted for durability and comfort. Made from high-quality leather with intricate stitching, they offer a perfect blend of style and practicality. Ideal for any occasion, they provide a comfortable fit and timeless appeal. Key Features: 100% genuine leather for premium quality and long-lasting wear Handcrafted by skilled artisans with traditional techniques Comfortable, flexible sole for all-day wear Timeless, classic design suitable for various occasions Durable construction that ensures lasting performance",,,7 | SKU: | Rs.12500.00 | Rs.16500.00 | Available:False | Inventory: || 8 | SKU: | Rs.12500.00 | Rs.16500.00 | Available:False | Inventory: || 9 | SKU: | Rs.12500.00 | Rs.16500.00 | Available:False | Inventory: || 10 | SKU: | Rs.12500.00 | Rs.16500.00 | Available:False | Inventory: || 11 | SKU: | Rs.12500.00 | Rs.16500.00 | Available:False | Inventory: || 12 | SKU: | Rs.12500.00 | Rs.16500.00 | Available:False | Inventory: || 13 | SKU: | Rs.12500.00 | Rs.16500.00 | Available:False | Inventory: || 14 | SKU: | Rs.12500.00 | Rs.16500.00 | Available:False | Inventory:,https://cdn.shopify.com/s/files/1/0696/6106/5406/files/hand-made-kaptan-chappal-brown-we003-140735.webp?v=1744968500 | https://cdn.shopify.com/s/files/1/0696/6106/5406/files/hand-made-kaptan-chappal-brown-we003-382458.webp?v=1744968501 | https://cdn.shopify.com/s/files/1/0696/6106/5406/files/hand-made-kaptan-chappal-brown-we003-281369.webp?v=1744968501 | https://cdn.shopify.com/s/files/1/0696/6106/5406/files/hand-made-kaptan-chappal-brown-we003-698344.webp?v=1744968500 | https://cdn.shopify.com/s/files/1/0696/6106/5406/files/hand-made-kaptan-chappal-brown-we003-365263.webp?v=1744968500 | https://cdn.shopify.com/s/files/1/0696/6106/5406/files/hand-made-kaptan-chappal-brown-we003-382975.webp?v=1744968501 | https://cdn.shopify.com/s/files/1/0696/6106/5406/files/hand-made-kaptan-chappal-brown-we003-409956.webp?v=1744968502 | https://cdn.shopify.com/s/files/1/0696/6106/5406/files/hand-made-kaptan-chappal-brown-we003-554176.webp?v=1744968501 | https://cdn.shopify.com/s/files/1/0696/6106/5406/files/kaptan-hand-made-chappal-we001-394313.webp?v=1747632087
Hand Made Leather Card Holder HMC01,Rs.2999.00,,https://wolveyes.com/products/hand-made-leather-card-holder,,False,"Step into luxury with the Hand made leather card holder , a perfect blend of sophistication and practicality. Featuring a high-gloss finish and an exquisite , this wallet is designed for those who value style and superior craftsmanship. High-Quality Material : Crafted from premium patent leather with a  Hand made leather card holder for a sleek and polished look. Elegant Finish : The glossy surface adds a refined touch, making it a standout accessory. Ample Storage : Includes multiple compartments for cash, cards, IDs, and coins, keeping your essentials organized. Compact Design : Sleek and lightweight, it fits comfortably in your hand or handbag. Secure Closure : Features a durable snap or zip closure to keep your items safe and secure.",,,green | SKU: | Rs.2999.00 |  | Available:True | Inventory: || bronze | SKU: | Rs.2999.00 |  | Available:True | Inventory:,https://cdn.shopify.com/s/files/1/0696/6106/5406/files/hand-made-leather-card-holder-444200.webp?v=1744968405 | https://cdn.shopify.com/s/files/1/0696/6106/5406/files/hand-made-leather-card-holder-912596.webp?v=1744968404 | https://cdn.shopify.com/s/files/1/0696/6106/5406/files/hand-made-leather-card-holder-788725.webp?v=1744968404 | https://cdn.shopify.com/s/files/1/0696/6106/5406/files/hand-made-leather-card-holder-608304.webp?v=1744968404 | https://cdn.shopify.com/s/files/1/0696/6106/5406/files/hand-made-leather-card-holder-833778.webp?v=1744968405 | https://cdn.shopify.com/s/files/1/0696/6106/5406/files/hand-made-leather-card-holder-876548.webp?v=1744968404 | https://cdn.shopify.com/s/files/1/0696/6106/5406/files/hand-made-leather-card-holder-608292.webp?v=1744968404 | https://cdn.shopify.com/s/files/1/0696/6106/5406/files/hand-made-leather-card-holder-207467.webp?v=1744968405
Hand made wallet bifold HMB01,Rs.6000.00,Rs.7500.00,https://wolveyes.com/products/hand-made-wallet-bifold,,True,"Step up your accessory game with the Hand made wallet bifold, a perfect blend of sleek elegance and distinctive texture. Made from high-quality Leather Wallet with biofold with a glossy , this wallet features a unique, textured surface that sets it apart from conventional leather designs. The rich black color adds sophistication, while the shiny, reflective finish brings a modern edge.",,,Brown | SKU: | Rs.6000.00 | Rs.7500.00 | Available:False | Inventory: || Green | SKU: | Rs.6000.00 | Rs.7500.00 | Available:False | Inventory:,https://cdn.shopify.com/s/files/1/0696/6106/5406/files/hand-made-wallet-bifold-850221.webp?v=1744968405 | https://cdn.shopify.com/s/files/1/0696/6106/5406/files/hand-made-wallet-bifold-243134.webp?v=1744994928 | https://cdn.shopify.com/s/files/1/0696/6106/5406/files/hand-made-wallet-bifold-249647.webp?v=1744994928 | https://cdn.shopify.com/s/files/1/0696/6106/5406/files/hand-made-wallet-bifold-570919.webp?v=1744994928 | https://cdn.shopify.com/s/files/1/0696/6106/5406/files/hand-made-wallet-bifold-327226.webp?v=1744994928 | https://cdn.shopify.com/s/files/1/0696/6106/5406/files/hand-made-wallet-bifold-438100.webp?v=1744994928 | https://cdn.shopify.com/s/files/1/0696/6106/5406/files/hand-made-wallet-bifold-528944.webp?v=1744994928 | https://cdn.shopify.com/s/files/1/0696/6106/5406/files/hand-made-wallet-bifold-473304.webp?v=1744994928 | https://cdn.shopify.com/s/files/1/0696/6106/5406/files/hand-made-wallet-bifold-656600.webp?v=1744994928 | https://cdn.shopify.com/s/files/1/0696/6106/5406/files/hand-made-wallet-bifold-358830.webp?v=1744994928 | https://cdn.shopify.com/s/files/1/0696/6106/5406/files/hand-made-wallet-bifold-333198.webp?v=1744994926 | https://cdn.shopify.com/s/files/1/0696/6106/5406/files/hand-made-wallet-bifold-520259.webp?v=1744994926 | https://cdn.shopify.com/s/files/1/0696/6106/5406/files/hand-made-wallet-bifold-685789.webp?v=1744968500 | https://cdn.shopify.com/s/files/1/0696/6106/5406/files/hand-made-wallet-bifold-673901.webp?v=1744968499 | https://cdn.shopify.com/s/files/1/0696/6106/5406/files/hand-made-wallet-bifold-134834.webp?v=1744968406
Hooded Leather Bomber Jacket SF002H,Rs.24999.00,Rs.29999.00,https://wolveyes.com/products/mc0006-004,,False,"Make a bold statement with the Nintenzo Black Hooded Leather Bomber Jacket , the perfect combination of rugged durability and modern streetwear style. Designed for those who appreciate versatility and edge, this jacket is an essential addition to your wardrobe. Premium Material : Crafted from high-quality genuine leather with a smooth black finish for a timeless and polished look. Built-In Hood : Features an attached hood for a layered aesthetic and added protection against the elements. Bomber Silhouette : A classic design with ribbed cuffs and hem for a snug and stylish fit. Functional Design : Includes secure zippered pockets and a sturdy front zipper closure for practicality. Urban Appeal : The fusion of leather craftsmanship and casual hooded style makes it perfect for both city adventures and casual outings.",mens,,XSmall | SKU:MC0006-004 | Rs.24999.00 | Rs.29999.00 | Available:True | Inventory: || Small | SKU:MC0006-005 | Rs.24999.00 | Rs.29999.00 | Available:True | Inventory: || Medium | SKU:MC0006-006 | Rs.24999.00 | Rs.29999.00 | Available:True | Inventory: || Large | SKU:MC0006-007 | Rs.24999.00 | Rs.29999.00 | Available:True | Inventory: || XLarge | SKU:MC0006-008 | Rs.24999.00 | Rs.29999.00 | Available:True | Inventory: || 2XLarge | SKU:MC0006-009 | Rs.24999.00 | Rs.29999.00 | Available:True | Inventory:,https://cdn.shopify.com/s/files/1/0696/6106/5406/files/nintenzo-black-hooded-leather-bomber-jacket-301146.jpg?v=1744968507 | https://cdn.shopify.com/s/files/1/0696/6106/5406/files/nintenzo-black-hooded-leather-bomber-jacket-535308.jpg?v=1744968507 | https://cdn.shopify.com/s/files/1/0696/6106/5406/files/nintenzo-black-hooded-leather-bomber-jacket-214570.jpg?v=1744968507 | https://cdn.shopify.com/s/files/1/0696/6106/5406/files/nintenzo-black-hooded-leather-bomber-jacket-799676.jpg?v=1744968507 | https://cdn.shopify.com/s/files/1/0696/6106/5406/files/nintenzo-black-hooded-leather-bomber-jacket-650879.jpg?v=1744968507 | https://cdn.shopify.com/s/files/1/0696/6106/5406/files/nintenzo-black-hooded-leather-bomber-jacket-917074.jpg?v=1744968507 | https://cdn.shopify.com/s/files/1/0696/6106/5406/files/ionic-beidge-leather-jacket-sf005-431469.jpg?v=1744968506
